{
  "asOf": "2026-06-16T10:41:04.000Z",
  "source": "coinmarketcap",
  "universeVersion": "0.1.0",
  "issuer": "bStocks",
  "venue": "pancakeswap-stocks",
  "venueUrl": "https://pancakeswap.finance/stocks",
  "sourceBaseUrl": "https://pro-api.coinmarketcap.com/v1/cryptocurrency/quotes/latest",
  "symbols": [
    "CRCLB",
    "MUB",
    "NVDAB",
    "SNDKB",
    "TSLAB"
  ],
  "candidateCount": 5,
  "candidates": [
    {
      "cmcId": 40212,
      "symbol": "MUB",
      "name": "Micron Technology Tokenized bStocks",
      "issuer": "bStocks",
      "venue": "pancakeswap-stocks",
      "venueUrl": "https://pancakeswap.finance/stocks",
      "cmcRank": 1411,
      "priceUsd": 1127.3335801221042,
      "volume24hUsd": 1835136.23194876,
      "percentChange1h": 0.34353949,
      "percentChange24h": 6.6497133,
      "percentChange7d": 23.09288321,
      "percentChange30d": 23.09288321,
      "marketCapUsd": 3229963.1583652487,
      "observedAt": "2026-06-16T10:41:04.000Z"
    },
    {
      "cmcId": 40216,
      "symbol": "SNDKB",
      "name": "SanDisk Tokenized bStocks",
      "issuer": "bStocks",
      "venue": "pancakeswap-stocks",
      "venueUrl": "https://pancakeswap.finance/stocks",
      "cmcRank": 1582,
      "priceUsd": 2159.3625244269933,
      "volume24hUsd": 2038562.77254547,
      "percentChange1h": 0.89453238,
      "percentChange24h": 3.42379605,
      "percentChange7d": 18.2845728,
      "percentChange30d": 18.2845728,
      "marketCapUsd": 2036386.9453312333,
      "observedAt": "2026-06-16T10:41:04.000Z"
    },
    {
      "cmcId": 40213,
      "symbol": "CRCLB",
      "name": "Circle Internet Group Tokenized bStocks",
      "issuer": "bStocks",
      "venue": "pancakeswap-stocks",
      "venueUrl": "https://pancakeswap.finance/stocks",
      "cmcRank": 1403,
      "priceUsd": 84.57327406033743,
      "volume24hUsd": 2852277.91514447,
      "percentChange1h": 0.02976463,
      "percentChange24h": 3.16884752,
      "percentChange7d": 0.64662517,
      "percentChange30d": 0.64662517,
      "marketCapUsd": 3298633.727171465,
      "observedAt": "2026-06-16T10:41:04.000Z"
    },
    {
      "cmcId": 40215,
      "symbol": "NVDAB",
      "name": "NVIDIA Tokenized bStocks",
      "issuer": "bStocks",
      "venue": "pancakeswap-stocks",
      "venueUrl": "https://pancakeswap.finance/stocks",
      "cmcRank": 1405,
      "priceUsd": 211.82037100677795,
      "volume24hUsd": 1277063.72744578,
      "percentChange1h": 0.03055277,
      "percentChange24h": 0.98081344,
      "percentChange7d": 4.33565945,
      "percentChange30d": 4.33565945,
      "marketCapUsd": 3293877.330674777,
      "observedAt": "2026-06-16T10:41:04.000Z"
    },
    {
      "cmcId": 40214,
      "symbol": "TSLAB",
      "name": "Tesla Tokenized bStocks",
      "issuer": "bStocks",
      "venue": "pancakeswap-stocks",
      "venueUrl": "https://pancakeswap.finance/stocks",
      "cmcRank": 1744,
      "priceUsd": 404.69764885553155,
      "volume24hUsd": 2764768.51386892,
      "percentChange1h": 0.16743697,
      "percentChange24h": -1.31986909,
      "percentChange7d": 2.89754611,
      "percentChange30d": 2.89754611,
      "marketCapUsd": 1436233.0160961729,
      "observedAt": "2026-06-16T10:41:04.000Z"
    }
  ]
}
